{
  "sha": "7638417db6d59f3c431d3e1f261cc637155684cd",
  "url": "https://api.github.com/repos/octocat/Hello-World/git/commits/7638417db6d59f3c431d3e1f261cc637155684cd",
  "author": {
    "date": "2008-07-09T16:13:30+12:00",
    "name": "Scott Chacon",
    "email": "schacon@gmail.com"
  },
  "committer": {
    "date": "2008-07-09T16:13:30+12:00",
    "name": "Scott Chacon",
    "email": "schacon@gmail.com"
  },
  "message": "my commit message",
  "tree": {
    "url": "https://api.github.com/repos/octocat/Hello-World/git/trees/827efc6d56897b048c772eb4087f854f46256132",
    "sha": "827efc6d56897b048c772eb4087f854f46256132"
  },
  "parents": [
    {
      "url": "https://api.github.com/repos/octocat/Hello-World/git/commits/7d1b31e74ee336d15cbd21741bc88a537ed063a0",
      "sha": "7d1b31e74ee336d15cbd21741bc88a537ed063a0"
    }
  ]
}